"Đường Hoàng Hoa Thám, Phường Thụy Khuê, Quận Tây Hồ, Hà Nội",Quận Tây Hồ,Phường Thụy Khuê,"Nhà ngõ, hẻm",Đã có sổ,4,3 phòng,25 m²,30 m,3.5 m,92 triệu/m²,2020,8,4,4/8/2020
"Đường Ba La, Phường Phú La, Quận Hà Đông, Hà Nội",Quận Hà Đông,Phường Phú La,"Nhà ngõ, hẻm",Đang chờ sổ,2,2 phòng,46 m²,9 m,5.1 m,"43,48 triệu/m²",2020,8,4,4/8/2020
"Đường Đội Cấn, Phường Đội Cấn, Quận Ba Đình, Hà Nội",Quận Ba Đình,Phường Đội Cấn,"Nhà ngõ, hẻm",Đang chờ sổ,4,3 phòng,42 m²,14 m,4 m,"63,1 triệu/m²",2020,8,4,4/8/2020
"Đường Phố Lụa||1855, Phường Vạn Phúc, Quận Hà Đông, Hà Nội",Quận Hà Đông,Phường Vạn Phúc,"Nhà ngõ, hẻm",Đã có sổ,4,3 phòng,34 m²,10 m,3.4 m,"79,41 triệu/m²",2020,8,4,4/8/2020
"Đường Trần Khát Chân, Phường Thanh Lương, Quận Hai Bà Trưng, Hà Nội",Quận Hai Bà Trưng,Phường Thanh Lương,"Nhà ngõ, hẻm",Đã có sổ,4,3 phòng,25 m²,10 m,3.4 m,86 triệu/m²,2020,8,4,4/8/2020
"Đường Lê Thanh Nghị, Phường Bách Khoa, Quận Hai Bà Trưng, Hà Nội",Quận Hai Bà Trưng,Phường Bách Khoa,"Nhà ngõ, hẻm",Đã có sổ,4,4 phòng,45 m²,10 m,3.4 m,"88,89 triệu/m²",2020,8,4,4/8/2020
"Đường Nguyễn Trãi, Phường Thanh Xuân Bắc, Quận Thanh Xuân, Hà Nội",Quận Thanh Xuân,Phường Thanh Xuân Bắc,"Nhà ngõ, hẻm",Đã có sổ,4,4 phòng,65 m²,12 m,5.5 m,"161,54 triệu/m²",2020,8,4,4/8/2020
"Đội cấn, Phường Đội Cấn, Quận Ba Đình, Hà Nội",Quận Ba Đình,Phường Đội Cấn,"Nhà ngõ, hẻm",Đã có sổ,4,3 phòng,32 m²,12 m,5.5 m,"89,06 triệu/m²",2020,8,4,4/8/2020
"Đường Hoàng Văn Thái, Phường Khương Mai, Quận Thanh Xuân, Hà Nội",Quận Thanh Xuân,Phường Khương Mai,"Nhà ngõ, hẻm",Đã có sổ,4,4 phòng,43 m²,11 m,4 m,"101,16 triệu/m²",2020,8,4,4/8/2020
"Nguyễn Xiểng, Phường Hạ Đình, Quận Thanh Xuân, Hà Nội",Quận Thanh Xuân,Phường Hạ Đình,"Nhà mặt phố, mặt tiền",Đã có sổ,4,5 phòng,50 m²,11 m,4 m,184 triệu/m²,2020,8,4,4/8/2020
"ngã tư sở, Phường Thanh Xuân Bắc, Quận Thanh Xuân, Hà Nội",Quận Thanh Xuân,Phường Thanh Xuân Bắc,"Nhà ngõ, hẻm",Đã có sổ,4,4 phòng,65 m²,12 m,5.5 m,"16,15 triệu/m²",2020,8,4,4/8/2020
"Đường Định Công||956, Phường Định Công, Quận Hoàng Mai, Hà Nội",Quận Hoàng Mai,Phường Định Công,"Nhà ngõ, hẻm",Đã có sổ,4,6 phòng,42 m²,12 m,5.5 m,"123,81 triệu/m²",2020,8,4,4/8/2020
"Đường Ngọc Thụy, Phường Ngọc Lâm, Quận Long Biên, Hà Nội",Quận Long Biên,Phường Ngọc Lâm,"Nhà ngõ, hẻm",Đã có sổ,4,3 phòng,38 m²,12.3 m,3.1 m,"77,89 triệu/m²",2020,8,4,4/8/2020
"Đường Kim Giang||979, Phường Đại Kim, Quận Hoàng Mai, Hà Nội",Quận Hoàng Mai,Phường Đại Kim,"Nhà ngõ, hẻm",Đã có sổ,4,3 phòng,30 m²,7 m,4 m,50 triệu/m²,2020,8,4,4/8/2020
"Đường Gốc Đề, Phường Minh Khai, Quận Hai Bà Trưng, Hà Nội",Quận Hai Bà Trưng,Phường Minh Khai,"Nhà ngõ, hẻm",Đã có sổ,4,2 phòng,63 m²,7 m,4 m,"56,35 triệu/m²",2020,8,4,4/8/2020
"Đường Nguyên Hồng, Phường Láng Hạ, Quận Đống Đa, Hà Nội",Quận Đống Đa,Phường Láng Hạ,"Nhà mặt phố, mặt tiền",Đã có sổ,4,4 phòng,95 m²,7 m,4 m,"268,42 triệu/m²",2020,8,4,4/8/2020
"Đường Lạc Long Quân, Phường Thụy Khuê, Quận Tây Hồ, Hà Nội",Quận Tây Hồ,Phường Thụy Khuê,"Nhà ngõ, hẻm",Đã có sổ,4,3 phòng,30 m²,7 m,4 m,"158,33 triệu/m²",2020,8,4,4/8/2020
"Đường Minh Khai, Phường Minh Khai, Quận Hai Bà Trưng, Hà Nội",Quận Hai Bà Trưng,Phường Minh Khai,"Nhà mặt phố, mặt tiền",Đã có sổ,4,3 phòng,41 m²,7 m,4 m,"68,29 triệu/m²",2020,8,4,4/8/2020
"Đường Thái Hà, Phường Trung Liệt, Quận Đống Đa, Hà Nội",Quận Đống Đa,Phường Trung Liệt,"Nhà mặt phố, mặt tiền",Đã có sổ,4,5 phòng,65 m²,7 m,4.6 m,"398,46 triệu/m²",2020,8,4,4/8/2020
"0912533345, Đường Quốc lộ 32, Xã Kim Chung, Huyện Hoài Đức, Hà Nội",Huyện Hoài Đức,Xã Kim Chung,"Nhà ngõ, hẻm",Đã có sổ,4,2 phòng,32 m²,7 m,5 m,"46,5 triệu/m²",2020,8,4,4/8/2020
"Đường Giang Văn Minh||243, Phường Đội Cấn, Quận Ba Đình, Hà Nội",Quận Ba Đình,Phường Đội Cấn,"Nhà ngõ, hẻm",Đã có sổ,4,3 phòng,30 m²,7 m,5 m,"86,67 triệu/m²",2020,8,4,4/8/2020
"Đường Xã Đàn, Phường Ô Chợ Dừa, Quận Đống Đa, Hà Nội",Quận Đống Đa,Phường Ô Chợ Dừa,"Nhà ngõ, hẻm",Đã có sổ,5,3 phòng,45 m²,7 m,5 m,"84,44 triệu/m²",2020,8,4,4/8/2020
"Mau luong, Xã Hữu Hoà, Huyện Thanh Trì, Hà Nội",Huyện Thanh Trì,Xã Hữu Hoà,"Nhà ngõ, hẻm",Đã có sổ,4,3 phòng,51.6 m²,7 m,5 m,"40,2 triệu/m²",2020,8,4,4/8/2020
"Đường Hoàng Hoa Thám, Phường Đội Cấn, Quận Ba Đình, Hà Nội",Quận Ba Đình,Phường Đội Cấn,"Nhà ngõ, hẻm",Đã có sổ,4,3 phòng,25 m²,7 m,5 m,94 triệu/m²,2020,8,4,4/8/2020
"Đường Thái Hà, Phường Trung Liệt, Quận Đống Đa, Hà Nội",Quận Đống Đa,Phường Trung Liệt,"Nhà mặt phố, mặt tiền",Đã có sổ,9,4 phòng,61 m²,13 m,4.6 m,"431,15 triệu/m²",2020,8,4,4/8/2020
"Đường Nguyễn Chí Thanh, Phường Láng Thượng, Quận Đống Đa, Hà Nội",Quận Đống Đa,Phường Láng Thượng,"Nhà ngõ, hẻm",Đã có sổ,4,3 phòng,85 m²,17 m,5 m,"68,82 triệu/m²",2020,8,4,4/8/2020
"Đường Kim Ngưu, Phường Vĩnh Tuy, Quận Hai Bà Trưng, Hà Nội",Quận Hai Bà Trưng,Phường Vĩnh Tuy,"Nhà ngõ, hẻm",Đã có sổ,4,4 phòng,38 m²,17 m,5 m,"85,53 triệu/m²",2020,8,4,4/8/2020
"Phố Khương Trung, Phường Khương Trung, Quận Thanh Xuân, Hà Nội",Quận Thanh Xuân,Phường Khương Trung,"Nhà ngõ, hẻm",Đã có sổ,4,5 phòng,45 m²,17 m,5 m,"77,78 triệu/m²",2020,8,4,4/8/2020
"Đường Ngọc Lâm, Phường Ngọc Lâm, Quận Long Biên, Hà Nội",Quận Long Biên,Phường Ngọc Lâm,"Nhà mặt phố, mặt tiền",Đã có sổ,4,3 phòng,73 m²,14 m,5.4 m,"58,9 triệu/m²",2020,8,4,4/8/2020
"Đường Âu Cơ, Phường Quảng An, Quận Tây Hồ, Hà Nội",Quận Tây Hồ,Phường Quảng An,Nhà biệt thự,Đã có sổ,4,5 phòng,160 m²,14 m,5.4 m,"212,5 triệu/m²",2020,8,4,4/8/2020
"Đường Giáp Bát, Phường Giáp Bát, Quận Hoàng Mai, Hà Nội",Quận Hoàng Mai,Phường Giáp Bát,"Nhà ngõ, hẻm",Đã có sổ,4,3 phòng,32 m²,14 m,5.4 m,"96,88 triệu/m²",2020,8,4,4/8/2020
Đường Đền Lừ 1,Quận Hoàng Mai,Phường Hoàng Văn Thụ,Nhà phố liền kề,Đã có sổ,7,6 phòng,40 m²,10 m,4 m,180 triệu/m²,2020,8,4,4/8/2020
"Đường Phú Diễn, Phường Phú Diễn, Quận Bắc Từ Liêm, Hà Nội",Quận Bắc Từ Liêm,Phường Phú Diễn,"Nhà ngõ, hẻm",Đã có sổ,6,10 phòng,50 m²,10 m,4 m,90 triệu/m²,2020,8,4,4/8/2020
"Đường Bát Khối, Phường Long Biên, Quận Long Biên, Hà Nội",Quận Long Biên,Phường Long Biên,"Nhà ngõ, hẻm",Đã có sổ,4,4 phòng,40 m²,9.7 m,4.12 m,"66,25 triệu/m²",2020,8,4,4/8/2020
"Đường Lâm Hạ, Phường Bồ Đề, Quận Long Biên, Hà Nội",Quận Long Biên,Phường Bồ Đề,"Nhà ngõ, hẻm",Đã có sổ,4,10 phòng,82 m²,9.7 m,4.12 m,"109,76 triệu/m²",2020,8,4,4/8/2020
"Đường Tô Hiệu, Phường Nguyễn Trãi, Quận Hà Đông, Hà Nội",Quận Hà Đông,Phường Nguyễn Trãi,"Nhà mặt phố, mặt tiền",Đã có sổ,4,5 phòng,50 m²,9.7 m,4.12 m,93 triệu/m²,2020,8,4,4/8/2020
"Đường Yên Hòa, Phường Yên Hoà, Quận Cầu Giấy, Hà Nội",Quận Cầu Giấy,Phường Yên Hoà,"Nhà ngõ, hẻm",Đã có sổ,4,3 phòng,32 m²,9.7 m,4.12 m,"84,38 triệu/m²",2020,8,4,4/8/2020
"Phố Yên Lạc, Phường Vĩnh Tuy, Hai Bà Trưng, Hà Nội",Quận Hai Bà Trưng,Phường Vĩnh Tuy,"Nhà ngõ, hẻm",Đã có sổ,4,3 phòng,47 m²,9.7 m,4.12 m,"89,36 triệu/m²",2020,8,4,4/8/2020
"Đường Nguyễn Tuân||678, Phường Thanh Xuân Bắc, Quận Thanh Xuân, Hà Nội",Quận Thanh Xuân,Phường Thanh Xuân Bắc,"Nhà ngõ, hẻm",Đã có sổ,4,4 phòng,60 m²,12 m,5.5 m,"17,5 triệu/m²",2020,8,4,4/8/2020
"thanh nhàn, Phường Thanh Nhàn, Quận Hai Bà Trưng, Hà Nội",Quận Hai Bà Trưng,Phường Thanh Nhàn,"Nhà ngõ, hẻm",Đã có sổ,4,4 phòng,42 m²,12 m,5.5 m,"76,19 triệu/m²",2020,8,4,4/8/2020
"Đường Lê Thanh Nghị, Phường Bách Khoa, Quận Hai Bà Trưng, Hà Nội",Quận Hai Bà Trưng,Phường Bách Khoa,"Nhà ngõ, hẻm",Đã có sổ,4,4 phòng,40 m²,12 m,5.5 m,"112,5 triệu/m²",2020,8,4,4/8/2020
"Đường Lĩnh Nam, Phường Lĩnh Nam, Quận Hoàng Mai, Hà Nội",Quận Hoàng Mai,Phường Lĩnh Nam,"Nhà ngõ, hẻm",Đã có sổ,5,4 phòng,45 m²,12 m,4 m,"66,67 triệu/m²",2020,8,4,4/8/2020
"20, Đường Cầu Giấy, Phường Nghĩa Đô, Quận Cầu Giấy, Hà Nội",Quận Cầu Giấy,Phường Nghĩa Đô,"Nhà ngõ, hẻm",Đã có sổ,4,4 phòng,38 m²,9.5 m,4.2 m,"89,47 triệu/m²",2020,8,4,4/8/2020
"Đường Nguyễn Văn Trỗi, Phường Phương Liệt, Quận Thanh Xuân, Hà Nội",Quận Thanh Xuân,Phường Phương Liệt,"Nhà ngõ, hẻm",Đã có sổ,4,4 phòng,50 m²,9.5 m,4.2 m,73 triệu/m²,2020,8,4,4/8/2020
"TAM KHƯƠNG, Phường Kim Liên, Quận Đống Đa, Hà Nội",Quận Đống Đa,Phường Kim Liên,"Nhà ngõ, hẻm",Đã có sổ,4,3 phòng,38 m²,9.5 m,4.2 m,"78,95 triệu/m²",2020,8,4,4/8/2020
"doãn kế thiện, Phường Mai Dịch, Quận Cầu Giấy, Hà Nội",Quận Cầu Giấy,Phường Mai Dịch,"Nhà ngõ, hẻm",Đã có sổ,5,4 phòng,50 m²,9.5 m,4.2 m,84.000 đ/m²,2020,8,4,4/8/2020
"Đường Kim Đồng, Phường Giáp Bát, Quận Hoàng Mai, Hà Nội",Quận Hoàng Mai,Phường Giáp Bát,"Nhà mặt phố, mặt tiền",Đã có sổ,9,nhiều hơn 10 phòng,100 m²,10 m,10 m,120 triệu/m²,2020,8,4,4/8/2020
"Đường Trường Chinh, Phường Khương Thượng, Quận Đống Đa, Hà Nội",Quận Đống Đa,Phường Khương Thượng,"Nhà mặt phố, mặt tiền",Đã có sổ,4,4 phòng,48 m²,10 m,10 m,"91,67 triệu/m²",2020,8,4,4/8/2020
"Đường Định Công||956, Phường Định Công, Quận Hoàng Mai, Hà Nội",Quận Hoàng Mai,Phường Định Công,"Nhà ngõ, hẻm",Đã có sổ,4,2 phòng,33 m²,10 m,10 m,"80,3 triệu/m²",2020,8,4,4/8/2020
"Đường Quan Nhân, Phường Thanh Xuân Bắc, Quận Thanh Xuân, Hà Nội",Quận Thanh Xuân,Phường Thanh Xuân Bắc,"Nhà ngõ, hẻm",Đã có sổ,4,5 phòng,65 m²,12 m,5.5 m,"16,15 triệu/m²",2020,8,4,4/8/2020
"Khương Trung, Phường Khương Đình, Quận Thanh Xuân, Hà Nội",Quận Thanh Xuân,Phường Khương Đình,"Nhà ngõ, hẻm",Đã có sổ,3,4 phòng,45 m²,12 m,5.5 m,"91,11 triệu/m²",2020,8,4,4/8/2020
"Đường Kim Mã, Phường Kim Mã, Quận Ba Đình, Hà Nội",Quận Ba Đình,Phường Kim Mã,"Nhà ngõ, hẻm",Đã có sổ,4,3 phòng,25 m²,12 m,5.5 m,108 triệu/m²,2020,8,4,4/8/2020
"Đường Lương Khánh Thiện, Phường Tân Mai, Quận Hoàng Mai, Hà Nội",Quận Hoàng Mai,Phường Tân Mai,"Nhà mặt phố, mặt tiền",Đã có sổ,4,4 phòng,60 m²,12 m,5.5 m,"91,67 triệu/m²",2020,8,4,4/8/2020
"Đường Mỗ Lao, Phường Mộ Lao, Quận Hà Đông, Hà Nội",Quận Hà Đông,Phường Mộ Lao,"Nhà ngõ, hẻm",Đã có sổ,5,9 phòng,39 m²,10 m,3.9 m,"92,31 triệu/m²",2020,8,4,4/8/2020
"Đường Minh Khai, Phường Vĩnh Tuy, Quận Hai Bà Trưng, Hà Nội",Quận Hai Bà Trưng,Phường Vĩnh Tuy,"Nhà mặt phố, mặt tiền",Đã có sổ,6,4 phòng,35 m²,10 m,3.9 m,"175,71 triệu/m²",2020,8,4,4/8/2020
"11, Đường Dương Quảng Hàm||817, Phường Quan Hoa, Quận Cầu Giấy, Hà Nội",Quận Cầu Giấy,Phường Quan Hoa,"Nhà ngõ, hẻm",Đã có sổ,5,3 phòng,31 m²,8 m,4 m,"129,03 triệu/m²",2020,8,4,4/8/2020
"Đường Nam Dư, Phường Lĩnh Nam, Quận Hoàng Mai, Hà Nội",Quận Hoàng Mai,Phường Lĩnh Nam,"Nhà ngõ, hẻm",Đã có sổ,4,4 phòng,31 m²,8 m,5 m,"74,19 triệu/m²",2020,8,4,4/8/2020
"36/5 bùi xương trạch, Phường Khương Đình, Quận Thanh Xuân, Hà Nội",Quận Thanh Xuân,Phường Khương Đình,"Nhà ngõ, hẻm",Đã có sổ,4,5 phòng,3659 m²,8 m,5 m,997.540 đ/m²,2020,8,4,4/8/2020
"Đường Phạm Ngọc Thạch, Phường Phương Liên, Quận Đống Đa, Hà Nội",Quận Đống Đa,Phường Phương Liên,"Nhà ngõ, hẻm",Đã có sổ,4,4 phòng,45 m²,11 m,4 m,"111,11 triệu/m²",2020,8,4,4/8/2020
"Đường Nguyễn Lân, Phường Phương Liệt, Quận Thanh Xuân, Hà Nội",Quận Thanh Xuân,Phường Phương Liệt,"Nhà ngõ, hẻm",Đã có sổ,4,5 phòng,53 m²,11 m,4.6 m,"116,98 triệu/m²",2020,8,4,4/8/2020
"Đường Nhân Hòa, Phường Nhân Chính, Quận Thanh Xuân, Hà Nội",Quận Thanh Xuân,Phường Nhân Chính,"Nhà ngõ, hẻm",Đã có sổ,4,2 phòng,42 m²,11 m,4.6 m,"83,33 triệu/m²",2020,8,4,4/8/2020
"Đường Thịnh Quang, Phường Thịnh Quang, Quận Đống Đa, Hà Nội",Quận Đống Đa,Phường Thịnh Quang,"Nhà ngõ, hẻm",Đã có sổ,5,5 phòng,50 m²,11 m,4.6 m,90 triệu/m²,2020,8,4,4/8/2020
"Đường Quan Nhân, Phường Nhân Chính, Quận Thanh Xuân, Hà Nội",Quận Thanh Xuân,Phường Nhân Chính,"Nhà ngõ, hẻm",Đã có sổ,4,4 phòng,34 m²,11 m,3.8 m,"88,24 triệu/m²",2020,8,4,4/8/2020
"Đường Trần Khát Chân, Phường Thanh Lương, Quận Hai Bà Trưng, Hà Nội",Quận Hai Bà Trưng,Phường Thanh Lương,Nhà biệt thự,Đã có sổ,3,9 phòng,150 m²,13 m,12 m,166 triệu/m²,2020,8,4,4/8/2020
"Phố Chùa Bộc, Phường Trung Phụng, Quận Đống Đa, Hà Nội",Quận Đống Đa,Phường Trung Phụng,"Nhà ngõ, hẻm",Đã có sổ,4,5 phòng,35 m²,7 m,5.5 m,"111,43 triệu/m²",2020,8,4,4/8/2020
"Đường Lê Trọng Tấn||663, Phường Khương Mai, Quận Thanh Xuân, Hà Nội",Quận Thanh Xuân,Phường Khương Mai,"Nhà ngõ, hẻm",Đã có sổ,4,4 phòng,47 m²,7 m,5.5 m,"79,79 triệu/m²",2020,8,4,4/8/2020
"64/12 Chính Kinh, Phường Nhân Chính, Quận Thanh Xuân, Hà Nội",Quận Thanh Xuân,Phường Nhân Chính,"Nhà ngõ, hẻm",Đã có sổ,4,4 phòng,6459 m²,7 m,5.5 m,410.280 đ/m²,2020,8,4,4/8/2020
"Đường Hoàng Minh Giám, Phường Trung Hoà, Quận Cầu Giấy, Hà Nội",Quận Cầu Giấy,Phường Trung Hoà,"Nhà mặt phố, mặt tiền",Đã có sổ,8,7 phòng,76 m²,7 m,5.5 m,"230,26 triệu/m²",2020,8,4,4/8/2020
"Đường Nguyễn Sơn, Phường Ngọc Lâm, Quận Long Biên, Hà Nội",Quận Long Biên,Phường Ngọc Lâm,"Nhà ngõ, hẻm",Đã có sổ,5,3 phòng,42 m²,7 m,5.5 m,"105,95 triệu/m²",2020,8,4,4/8/2020
"Đường Lương Thế Vinh, Phường Mễ Trì, Quận Nam Từ Liêm, Hà Nội",Quận Nam Từ Liêm,Phường Mễ Trì,Nhà phố liền kề,Đã có sổ,4,5 phòng,113 m²,7 m,85 m,"134,51 triệu/m²",2020,8,4,4/8/2020
"Đường Trần Đại Nghĩa||607, Phường Đồng Tâm, Quận Hai Bà Trưng, Hà Nội",Quận Hai Bà Trưng,Phường Đồng Tâm,"Nhà ngõ, hẻm",Đã có sổ,4,4 phòng,42 m²,7 m,85 m,"107,14 triệu/m²",2020,8,4,4/8/2020
"LẠC LONG QUÂN, Phường Xuân La, Quận Tây Hồ, Hà Nội",Quận Tây Hồ,Phường Xuân La,"Nhà ngõ, hẻm",Đã có sổ,4,4 phòng,52 m²,7 m,85 m,100 triệu/m²,2020,8,4,4/8/2020
"Đường Hòa Bình||1785, Phường Yên Nghĩa, Quận Hà Đông, Hà Nội",Quận Hà Đông,Phường Yên Nghĩa,"Nhà ngõ, hẻm",Đã có sổ,4,3 phòng,40 m²,6.7 m,6 m,"40,5 triệu/m²",2020,8,4,4/8/2020
"Yên Lộ, Phường Yên Nghĩa, Quận Hà Đông, Hà Nội",Quận Hà Đông,Phường Yên Nghĩa,"Nhà ngõ, hẻm",Đã có sổ,4,3 phòng,35 m²,6.7 m,6 m,"57,14 triệu/m²",2020,8,4,4/8/2020
"Đường Minh Khai, Phường Minh Khai, Quận Hai Bà Trưng, Hà Nội",Quận Hai Bà Trưng,Phường Minh Khai,"Nhà ngõ, hẻm",Đã có sổ,4,4 phòng,44 m²,11 m,4 m,"67,05 triệu/m²",2020,8,4,4/8/2020
"Đường Lê Duẩn, Phường Phương Liên, Quận Đống Đa, Hà Nội",Quận Đống Đa,Phường Phương Liên,"Nhà ngõ, hẻm",Đã có sổ,5,6 phòng,35 m²,11 m,4 m,"78,57 triệu/m²",2020,8,4,4/8/2020
"Đường Mỹ Đình 1, Phường Mỹ Đình 1, Quận Nam Từ Liêm, Hà Nội",Quận Nam Từ Liêm,Phường Mỹ Đình 1,"Nhà mặt phố, mặt tiền",Đã có sổ,4,5 phòng,40 m²,11 m,3.5 m,"98,75 triệu/m²",2020,8,4,4/8/2020
"Đường Trường Chinh, Phường Phương Liệt, Quận Thanh Xuân, Hà Nội",Quận Thanh Xuân,Phường Phương Liệt,"Nhà ngõ, hẻm",Đã có sổ,4,6 phòng,40 m²,11 m,3.5 m,"87,5 triệu/m²",2020,8,4,4/8/2020
"Đường Giải Phóng, Phường Giáp Bát, Quận Hoàng Mai, Hà Nội",Quận Hoàng Mai,Phường Giáp Bát,"Nhà ngõ, hẻm",Đã có sổ,4,4 phòng,33 m²,11 m,3.5 m,"60,61 triệu/m²",2020,8,4,4/8/2020
"Trần Đại Nghĩa, Phường Thanh Lương, Quận Hai Bà Trưng, Hà Nội",Quận Hai Bà Trưng,Phường Thanh Lương,"Nhà ngõ, hẻm",Đã có sổ,4,4 phòng,30 m²,11 m,4 m,"83,33 triệu/m²",2020,8,4,4/8/2020
"Đường Giáp Bát, Phường Giáp Bát, Quận Hoàng Mai, Hà Nội",Quận Hoàng Mai,Phường Giáp Bát,"Nhà ngõ, hẻm",Đã có sổ,1,1 phòng,42 m²,11 m,4 m,"47,62 triệu/m²",2020,8,4,4/8/2020
"Đường Thái Thịnh, Phường Thịnh Quang, Quận Đống Đa, Hà Nội",Quận Đống Đa,Phường Thịnh Quang,"Nhà ngõ, hẻm",Đã có sổ,4,4 phòng,37 m²,11 m,4 m,"82,43 triệu/m²",2020,8,4,4/8/2020
"Đường Phương Mai, Phường Phương Mai, Quận Đống Đa, Hà Nội",Quận Đống Đa,Phường Phương Mai,"Nhà ngõ, hẻm",Đã có sổ,3,3 phòng,40 m²,11 m,4 m,85 triệu/m²,2020,8,4,4/8/2020
"201/99 Định Công Hạ, Phường Định Công, Quận Hoàng Mai, Hà Nội",Quận Hoàng Mai,Phường Định Công,"Nhà ngõ, hẻm",Đã có sổ,4,4 phòng,201.37 m²,11 m,4 m,"12,44 triệu/m²",2020,8,4,4/8/2020
"Đường Hồng Mai||532, Phường Minh Khai, Quận Hai Bà Trưng, Hà Nội",Quận Hai Bà Trưng,Phường Minh Khai,"Nhà ngõ, hẻm",Đã có sổ,4,5 phòng,45 m²,11 m,4 m,"83,33 triệu/m²",2020,8,4,4/8/2020
"hòa bình, Phường Yên Nghĩa, Quận Hà Đông, Hà Nội",Quận Hà Đông,Phường Yên Nghĩa,"Nhà ngõ, hẻm",Đã có sổ,4,3 phòng,37 m²,10 m,3.7 m,"37,84 triệu/m²",2020,8,4,4/8/2020
"Đường Kim Giang, Phường Đại Kim, Quận Hoàng Mai, Hà Nội",Quận Hoàng Mai,Phường Đại Kim,"Nhà ngõ, hẻm",Đã có sổ,4,4 phòng,50 m²,10 m,3.7 m,60 triệu/m²,2020,8,4,4/8/2020
"Đường Nguyễn Khuyến||410, Phường Văn Miếu, Quận Đống Đa, Hà Nội",Quận Đống Đa,Phường Văn Miếu,"Nhà ngõ, hẻm",Đã có sổ,5,5 phòng,31 m²,10 m,3.7 m,"80,65 triệu/m²",2020,8,4,4/8/2020
Đường Xã Đàn,Quận Đống Đa,Phường Trung Phụng,"Nhà ngõ, hẻm",Đã có sổ,4,3 phòng,35 m²,10 m,3.7 m,"74,29 triệu/m²",2020,8,4,4/8/2020
"Đường Lĩnh Nam, Phường Lĩnh Nam, Quận Hoàng Mai, Hà Nội",Quận Hoàng Mai,Phường Lĩnh Nam,"Nhà mặt phố, mặt tiền",Đã có sổ,4,3 phòng,30 m²,7.4 m,4.1 m,"103,33 triệu/m²",2020,8,4,4/8/2020
"Đường Quan Nhân, Phường Khương Đình, Quận Thanh Xuân, Hà Nội",Quận Thanh Xuân,Phường Khương Đình,"Nhà ngõ, hẻm",Đã có sổ,4,5 phòng,52 m²,11.5 m,4.5 m,"90,38 triệu/m²",2020,8,4,4/8/2020
"Phố Vũ Tông Phan, Phường Khương Đình, Thanh Xuân, Hà nôi",Quận Thanh Xuân,Phường Khương Đình,"Nhà ngõ, hẻm",Đã có sổ,4,5 phòng,36 m²,11.5 m,4.5 m,"97,22 triệu/m²",2020,8,4,4/8/2020
"Đường Vĩnh Tuy||628, Phường Minh Khai, Quận Hai Bà Trưng, Hà Nội",Quận Hai Bà Trưng,Phường Minh Khai,"Nhà ngõ, hẻm",Đã có sổ,4,4 phòng,46 m²,11.5 m,4.5 m,"106,52 triệu/m²",2020,8,4,4/8/2020
"Đường Tân Mai, Phường Tân Mai, Quận Hoàng Mai, Hà Nội",Quận Hoàng Mai,Phường Tân Mai,"Nhà ngõ, hẻm",Giấy tờ khác,4,3 phòng,33 m²,8 m,3.7 m,"112,12 triệu/m²",2020,8,4,4/8/2020
"Đường Kim Mã, Phường Kim Mã, Quận Ba Đình, Hà Nội",Quận Ba Đình,Phường Kim Mã,"Nhà mặt phố, mặt tiền",Đã có sổ,4,4 phòng,46 m²,9 m,5 m,"108,7 triệu/m²",2020,8,4,4/8/2020
"Đường Giải Phóng, Phường Thịnh Liệt, Quận Hoàng Mai, Hà Nội",Quận Hoàng Mai,Phường Thịnh Liệt,"Nhà mặt phố, mặt tiền",Đã có sổ,5,3 phòng,35 m²,10 m,3.5 m,100 triệu/m²,2020,8,4,4/8/2020
"Đường Lê Duẩn, Phường Kim Liên, Quận Đống Đa, Hà Nội",Quận Đống Đa,Phường Kim Liên,"Nhà ngõ, hẻm",Đã có sổ,5,6 phòng,42 m²,10 m,3.5 m,"83,33 triệu/m²",2020,8,4,4/8/2020
"Đường Phạm Ngọc Thạch, Phường Phương Liên, Quận Đống Đa, Hà Nội",Quận Đống Đa,Phường Phương Liên,"Nhà ngõ, hẻm",Đã có sổ,5,3 phòng,30 m²,10 m,3.5 m,"133,33 triệu/m²",2020,8,4,4/8/2020
"Đường Ô Chợ Dừa||416, Phường Ô Chợ Dừa, Quận Đống Đa, Hà Nội",Quận Đống Đa,Phường Ô Chợ Dừa,"Nhà ngõ, hẻm",Đã có sổ,3,3 phòng,29 m²,10 m,4 m,"96,55 triệu/m²",2020,8,4,4/8/2020
"Đường Huyền Kỳ, Phường Phú Lương, Quận Hà Đông, Hà Nội",Quận Hà Đông,Phường Phú Lương,"Nhà ngõ, hẻm",Đã có sổ,4,3 phòng,30 m²,10 m,4 m,"56,67 triệu/m²",2020,8,4,4/8/2020
"Tôn Đức Thắng, Phường Văn Chương, Quận Đống Đa, Hà Nội",Quận Đống Đa,Phường Văn Chương,"Nhà ngõ, hẻm",Đã có sổ,4,3 phòng,40 m²,10 m,4 m,70 triệu/m²,2020,8,4,4/8/2020
"Đường Chùa Láng, Phường Láng Hạ, Quận Đống Đa, Hà Nội",Quận Đống Đa,Phường Láng Hạ,"Nhà ngõ, hẻm",Đã có sổ,4,4 phòng,35 m²,10 m,4 m,100 triệu/m²,2020,8,4,4/8/2020
"Đường Cầu Lủ, Phường Kim Giang, Quận Thanh Xuân, Hà Nội",Quận Thanh Xuân,Phường Kim Giang,"Nhà mặt phố, mặt tiền",Đã có sổ,5,3 phòng,33 m²,10 m,4 m,"80,3 triệu/m²",2020,8,4,4/8/2020
"Đường Kim Giang, Phường Hoàng Liệt, Quận Hoàng Mai, Hà Nội",Quận Hoàng Mai,Phường Hoàng Liệt,"Nhà ngõ, hẻm",Đã có sổ,4,3 phòng,35 m²,9 m,4 m,"82,86 triệu/m²",2020,8,4,4/8/2020
"Đường Kim Giang, Phường Đại Kim, Quận Hoàng Mai, Hà Nội",Quận Hoàng Mai,Phường Đại Kim,"Nhà ngõ, hẻm",Đã có sổ,4,4 phòng,60 m²,9 m,4 m,"63,33 triệu/m²",2020,8,4,4/8/2020
"Đường Đại Từ, Phường Đại Kim, Quận Hoàng Mai, Hà Nội",Quận Hoàng Mai,Phường Đại Kim,"Nhà ngõ, hẻm",Đã có sổ,4,4 phòng,60 m²,9 m,4 m,"61,67 triệu/m²",2020,8,4,4/8/2020
"Thanh Lân, Phường Thanh Trì, Quận Hoàng Mai, Hà Nội",Quận Hoàng Mai,Phường Thanh Trì,"Nhà ngõ, hẻm",Đã có sổ,4,3 phòng,30 m²,9 m,4 m,70 triệu/m²,2020,8,4,4/8/2020
"Đường Trần Đại Nghĩa||607, Phường Đồng Tâm, Quận Hai Bà Trưng, Hà Nội",Quận Hai Bà Trưng,Phường Đồng Tâm,"Nhà ngõ, hẻm",Đã có sổ,4,4 phòng,42 m²,9 m,4 m,"110,71 triệu/m²",2020,8,4,4/8/2020
"Đường Khương Đình, Phường Khương Đình, Quận Thanh Xuân, Hà Nội",Quận Thanh Xuân,Phường Khương Đình,"Nhà ngõ, hẻm",Đã có sổ,4,2 phòng,62 m²,9 m,4.5 m,"53,23 triệu/m²",2020,8,4,4/8/2020
"Đường Bùi Xương Trạch, Phường Khương Đình, Quận Thanh Xuân, Hà Nội",Quận Thanh Xuân,Phường Khương Đình,"Nhà ngõ, hẻm",Đã có sổ,5,3 phòng,38 m²,9 m,4.5 m,"92,11 triệu/m²",2020,8,4,4/8/2020
"Đường Sài Đồng, Phường Sài Đồng, Quận Long Biên, Hà Nội",Quận Long Biên,Phường Sài Đồng,"Nhà ngõ, hẻm",Đã có sổ,4,3 phòng,60 m²,10 m,6 m,80 triệu/m²,2020,8,4,4/8/2020
"Đường Phạm Ngọc Thạch, Phường Phương Liên, Quận Đống Đa, Hà Nội",Quận Đống Đa,Phường Phương Liên,"Nhà ngõ, hẻm",Đã có sổ,5,3 phòng,35 m²,10 m,6 m,"115,71 triệu/m²",2020,8,4,4/8/2020
"Đường Kim Hoa, Phường Kim Liên, Quận Đống Đa, Hà Nội",Quận Đống Đa,Phường Kim Liên,"Nhà ngõ, hẻm",Đã có sổ,5,5 phòng,43 m²,10 m,6 m,"79,07 triệu/m²",2020,8,4,4/8/2020
"Đường La Thành, Phường Láng Hạ, Quận Đống Đa, Hà Nội",Quận Đống Đa,Phường Láng Hạ,"Nhà ngõ, hẻm",Đã có sổ,4,3 phòng,70 m²,10 m,6 m,"61,43 triệu/m²",2020,8,4,4/8/2020
"Đường Vũ Trọng Phụng||702, Phường Nhân Chính, Quận Thanh Xuân, Hà Nội",Quận Thanh Xuân,Phường Nhân Chính,"Nhà ngõ, hẻm",Đã có sổ,4,2 phòng,35 m²,10 m,6 m,"101,43 triệu/m²",2020,8,4,4/8/2020
"25, lê thanh nghị, Phường Bách Khoa, Quận Hai Bà Trưng, Hà Nội",Quận Hai Bà Trưng,Phường Bách Khoa,"Nhà ngõ, hẻm",Đã có sổ,4,5 phòng,42 m²,10 m,4.1 m,"80,95 triệu/m²",2020,8,4,4/8/2020
"Đường Bùi Xương Trạch, Phường Khương Đình, Quận Thanh Xuân, Hà Nội",Quận Thanh Xuân,Phường Khương Đình,"Nhà ngõ, hẻm",Đã có sổ,5,3 phòng,38 m²,10 m,4.1 m,"92,11 triệu/m²",2020,8,4,4/8/2020
